{
  "schema_version": "draft-configuration-v1",
  "project_id": "e2e-scenario-b",
  "construction_profile_id": "alpha-basis-v1",
  "source_refs": [
    {
      "id": "NOTE_B",
      "type": "NOTE",
      "file": "scenario_b_description.md",
      "note": "Scenario B: image + description; width is a DEFAULT_CANDIDATE needing confirmation, height and depth come from vision."
    }
  ],
  "global_dimensions": {
    "finished_worktop_height_mm": 910,
    "toe_kick_height_mm": 100,
    "countertop_thickness_mm": 40
  },
  "assemblies": [
    {
      "id": "ASM_B",
      "kind": "LINEAR_RUN",
      "overall_width_mm": 600,
      "overall_depth_mm": 560,
      "finished_height_mm": 910,
      "modules": [
        {
          "id": "MOD_B_01",
          "module_type": "BASE_CABINET",
          "role": "GENERAL_STORAGE",
          "x_mm": 0,
          "y_mm": 100,
          "dimensions": {
            "width_mm": {
              "state": "NEEDS_CONFIRMATION",
              "value": 600,
              "source_type": "DEFAULT_CANDIDATE",
              "source_ref": "NOTE_B",
              "evidence_state": "ALPHA_DEFAULT",
              "note": "Default candidate width 600 awaiting confirmation."
            },
            "height_mm": { "state": "MISSING" },
            "depth_mm": { "state": "MISSING" }
          },
          "fronts": [
            {
              "kind": "HINGED_DOOR",
              "count": 1,
              "evidence_state": "VISUAL_INFERRED"
            }
          ],
          "appliance_slots": [],
          "notes": [
            "Base cabinet; width default candidate, height and depth from vision."
          ]
        }
      ],
      "openings": [],
      "non_carcass_surfaces": []
    }
  ]
}